{
  "$schema": "https://json-schema.org/draft/2020-12/schema",
  "title": "EGC dashboard data",
  "type": "object",
  "required": ["generated_at", "periods", "team", "members"],
  "properties": {
    "generated_at": { "type": "string", "format": "date-time" },
    "source": { "type": "string" },
    "periods": {
      "type": "array",
      "items": { "enum": ["7d", "30d", "90d", "180d", "all"] },
      "minItems": 1
    },
    "total_followers": { "type": "number" },
    "team": { "$ref": "#/$defs/periodMap" },
    "members": {
      "type": "array",
      "minItems": 1,
      "items": { "$ref": "#/$defs/member" }
    }
  },
  "$defs": {
    "periodMap": {
      "type": "object",
      "additionalProperties": { "$ref": "#/$defs/period" }
    },
    "member": {
      "type": "object",
      "required": ["name", "periods"],
      "properties": {
        "name": { "type": "string" },
        "headline": { "type": "string" },
        "followers_total": { "type": "number" },
        "slug": { "type": "string" },
        "photo": { "type": "string" },
        "activity_posts": {
          "type": "array",
          "description": "Optional all-post dated feed used for activity heatmaps. If omitted, top_posts are used as a partial fallback.",
          "items": { "$ref": "#/$defs/activityPost" }
        },
        "activity_coverage": {
          "type": "object",
          "description": "Optional coverage metadata for the activity feed.",
          "properties": {
            "aggregate_posts": { "type": "number" },
            "dated_posts": { "type": "number" }
          }
        },
        "periods": { "$ref": "#/$defs/periodMap" }
      }
    },
    "period": {
      "type": "object",
      "properties": {
        "posts": { "type": "number" },
        "impressions": { "type": "number" },
        "likes": { "type": "number" },
        "comments": { "type": "number" },
        "reposts": { "type": "number" },
        "engagements": { "type": "number" },
        "eng_rate": { "type": "number" },
        "avg": {
          "type": "object",
          "properties": {
            "impressions": { "type": "number" },
            "likes": { "type": "number" },
            "comments": { "type": "number" },
            "reposts": { "type": "number" }
          }
        },
        "top_posts": {
          "type": "array",
          "items": { "$ref": "#/$defs/topPost" }
        }
      }
    },
    "topPost": {
      "type": "object",
      "required": ["posted_at", "impressions"],
      "properties": {
        "urn": { "type": "string" },
        "url": { "type": "string" },
        "posted_at": { "type": "string", "format": "date-time" },
        "impressions": { "type": "number" },
        "likes": { "type": "number" },
        "comments": { "type": "number" },
        "reposts": { "type": "number" },
        "text": { "type": "string" }
      }
    },
    "activityPost": {
      "type": "object",
      "required": ["posted_at"],
      "properties": {
        "urn": { "type": "string" },
        "url": { "type": "string" },
        "posted_at": { "type": "string", "format": "date-time" },
        "impressions": { "type": "number" },
        "likes": { "type": "number" },
        "comments": { "type": "number" },
        "reposts": { "type": "number" },
        "text": { "type": "string" },
        "source_flags": {
          "type": "array",
          "items": { "type": "string" }
        }
      }
    }
  }
}
